title|summary|link|similarity|y
North Korea Fires Medium-Range Ballistic Missile|North Korea’s leader, Kim Jong-un, with scientists and technicians said to have developed the Hwasong-12 missile, in an undated photo released by North Korea.|https://www.nytimes.com/2017/05/21/world/asia/north-korea-missile.html?partner=rss&emc=rss|0.502328778226|1
North Korea fires second ballistic missile in a week|North Korea fired an unidentified ballistic missile, according to the South Korean military's Joint Chiefs of Staff.|http://rss.cnn.com/~r/rss/cnn_latest/~3/rWUqOm2IEaQ/index.html|0.449436416524|1
China Is Reluctant to Blame North Korea, Its Ally, for Cyberattack|An internet cafe in China. Around 40,000 institutions in China have been hit by a recent cyberattack.|https://www.nytimes.com/2017/05/17/world/asia/china-north-korea-ransomware.html?partner=rss&emc=rss|0.410362644952|1
North Korea vows to strengthen nuclear program as US increases pressure|North Korea’s deputy U.N. envoy said on Friday that the country will continue to strengthen its nuclear program as a necessary measure needed to counter U.S. aggression.|http://feeds.foxnews.com/~r/foxnews/world/~3/BWECMqzVkX4/north-korea-vows-to-strengthen-nuclear-program-as-us-increases-pressure.html|0.379978361591|1
Focus Turns to North Korea Sleeper Cells as Possible Culprits in Cyberattack|Workers at the Korea Internet and Security Agency in Seoul, South Korea, monitored the spread of ransomware cyberattacks on Monday.|https://www.nytimes.com/2017/05/16/world/asia/north-korea-cyber-sleeper-cells-ransomware.html?partner=rss&emc=rss|0.355476777955|1
North Korea launches another mid-range ballistic missile, officials say|South Korea’s military said on Sunday that North Korea launched an unidentified projectile, a week after it test fired a mid-long range missile.|http://feeds.foxnews.com/~r/foxnews/most-popular/~3/vmupzl2K0ds/north-korea-launches-another-mid-range-ballistic-missile-officials-say.html|0.355476777955|1
Bits: Daily Report: Evidence Points to North Korea in Ransomware Attack|Workers at the Korea Internet and Security Agency in Seoul, South Korea, monitored the spread of ransomware cyberattacks on Monday.|https://www.nytimes.com/2017/05/17/technology/daily-report-evidence-points-to-north-korea-in-ransomware-attack.html?partner=rss&emc=rss|0.355476777955|1
Exclusive: North Korea's Unit 180, the cyber warfare cell that worries the West|SEOUL (Reuters) - North Korea's main spy agency has a special cell called Unit 180 that is likely to have launched some of its most daring and successful cyber attacks, according to defectors, officials and internet security experts.|http://feeds.reuters.com/~r/reuters/technologyNews/~3/m6D1TsatXug/us-cyber-northkorea-exclusive-idUSKCN18H020|0.335175743328|1
North Korea tests another missile; Seoul says dashes hopes for peace|SEOUL (Reuters) - North Korea fired a ballistic missile into waters off its east coast on Sunday, its second missile test in a week, which South Korea said dashed the hopes of the South's new liberal government for peace between the neighbors.|http://feeds.reuters.com/~r/reuters/topNews/~3/fWpTyadDcwU/us-northkorea-missiles-idUSKBN18H0A6|0.335175743328|1
N. Korea fires ballistic missile|North Korea fired an unidentified projectile from areas near Pukchang in North Korea, according to a press release by South Korean military's Joint Chiefs of Staff.|http://rss.cnn.com/~r/rss/cnn_topstories/~3/rWUqOm2IEaQ/index.html|0.220288150562|1
